{
  "schemaVersion": "1.0",
  "messageId": "13131313-1313-4313-8313-131313131313",
  "messageType": "ARTIFACT_MANIFEST",
  "occurredAt": "2026-08-27T18:05:01Z",
  "producer": "kaas-runner",
  "correlationId": "77777777-7777-4777-8777-777777777777",
  "causationId": "66666666-6666-4666-8666-666666666666",
  "manifestId": "eeeeeeee-eeee-4eee-8eee-eeeeeeeeeeee",
  "commandId": "66666666-6666-4666-8666-666666666666",
  "organizationId": "11111111-1111-4111-8111-111111111111",
  "projectId": "22222222-2222-4222-8222-222222222222",
  "runId": "33333333-3333-4333-8333-333333333333",
  "runVersion": 6,
  "attemptId": "44444444-4444-4444-8444-444444444444",
  "attemptNumber": 1,
  "assignmentEpoch": 7,
  "createdAt": "2026-08-27T18:05:00Z",
  "artifacts": [
    {
      "artifactId": "14141414-1414-4414-8414-141414141414",
      "type": "KARATE_HTML_REPORT",
      "contentType": "text/html",
      "sizeBytes": 4096,
      "sha256": "sha256:aaaaaaaaaaaaaaaaaaaaaaaaaaaaaaaaaaaaaaaaaaaaaaaaaaaaaaaaaaaaaaaa",
      "objectReferenceId": "object-ref:artifact_14141414",
      "createdAt": "2026-08-27T18:04:59Z"
    },
    {
      "artifactId": "15151515-1515-4515-8515-151515151515",
      "type": "RAW_RESULT",
      "contentType": "application/json",
      "sizeBytes": 2048,
      "sha256": "sha256:bbbbbbbbbbbbbbbbbbbbbbbbbbbbbbbbbbbbbbbbbbbbbbbbbbbbbbbbbbbbbbbb",
      "objectReferenceId": "object-ref:artifact_15151515",
      "createdAt": "2026-08-27T18:05:00Z"
    }
  ]
}
